{
  "intent_id": "sha256:a22270a44b9b87c8b7ea50eac341d822419c9995b8671acdf96817a1eddde690",
  "generation_id": "cccccccccccccccccccccccccccccccccccccccccccccccccccccccccccccccc",
  "response_status": 201,
  "engine_id": "eeeeeeeeeeeeeeeeeeeeeeeeeeeeeeeeeeeeeeeeeeeeeeeeeeeeeeeeeeeeeeee",
  "response_digest": "sha256:ee2afb01df3ac299c638a109ccc34e50ceed1d0d873c65fec03e5a9446576360"
}
